{
  "$schema": "https://json-schema.org/draft/2020-12/schema",
  "$id": "https://kevinrapley.github.io/flux-behaviour/contracts/events/flux-event.schema.json",
  "title": "Flux Behaviour event",
  "description": "Metadata-only event contract for consented Flux Behaviour instrumentation.",
  "type": "object",
  "additionalProperties": false,
  "required": [
    "schema_version",
    "session_id",
    "visitor_id",
    "tenant_id",
    "consent",
    "origin",
    "event_class",
    "action",
    "role",
    "element_key",
    "timestamp_ms"
  ],
  "allOf": [
    {
      "if": {
        "properties": {
          "action": {
            "pattern": "^auth\\.otp\\.(requested|succeeded|failed)$"
          }
        },
        "required": ["action"]
      },
      "then": {
        "properties": {
          "event_class": { "const": "trust" },
          "role": { "const": "service" },
          "element_key": { "const": "auth.otp" }
        },
        "not": {
          "anyOf": [
            { "required": ["value_length"] },
            { "required": ["edit_count"] },
            { "required": ["duration_ms"] },
            { "required": ["reason"] },
            { "required": ["navigation_direction"] },
            { "required": ["pointer_type"] },
            { "required": ["file_count"] },
            { "required": ["file_size_bucket"] },
            { "required": ["key_press_count"] },
            { "required": ["backspace_count"] },
            { "required": ["paste_count"] },
            { "required": ["chars_per_minute"] },
            { "required": ["revisit_count"] }
          ]
        }
      }
    },
    {
      "if": {
        "properties": {
          "action": { "const": "flow.submit" },
          "element_key": { "pattern": "^form\\.auth(?:[.:-]|$)" }
        },
        "required": ["action", "element_key"]
      },
      "then": false
    },
    {
      "if": {
        "properties": { "action": { "const": "field.blur" } },
        "required": ["action", "value_length"]
      },
      "then": {
        "anyOf": [
          { "properties": { "key_press_count": { "minimum": 1 } }, "required": ["key_press_count"] },
          { "properties": { "edit_count": { "minimum": 1 } }, "required": ["edit_count"] },
          { "properties": { "paste_count": { "minimum": 1 } }, "required": ["paste_count"] }
        ]
      }
    }
  ],
  "properties": {
    "schema_version": {
      "type": "string",
      "const": "1.1.0"
    },
    "session_id": {
      "type": "string",
      "minLength": 8,
      "maxLength": 128,
      "pattern": "^[A-Za-z0-9._:-]+$"
    },
    "visitor_id": {
      "type": "string",
      "minLength": 8,
      "maxLength": 128,
      "pattern": "^[A-Za-z0-9._:-]+$"
    },
    "tenant_id": {
      "type": "string",
      "minLength": 2,
      "maxLength": 80,
      "pattern": "^[a-z][a-z0-9-]*$"
    },
    "consent": {
      "type": "string",
      "const": "yes"
    },
    "origin": {
      "type": "string",
      "enum": [
        "formkit",
        "sdk",
        "collector-test"
      ]
    },
    "event_class": {
      "type": "string",
      "enum": [
        "focus",
        "input",
        "nav",
        "kbd",
        "clipboard",
        "drop",
        "file",
        "picker",
        "trust",
        "assist",
        "a11y",
        "env"
      ]
    },
    "action": {
      "type": "string",
      "minLength": 3,
      "maxLength": 80,
      "pattern": "^[a-z][a-z0-9]*(?:[._:-][a-z0-9]+)*$"
    },
    "role": {
      "type": "string",
      "enum": [
        "field",
        "form",
        "control",
        "page",
        "service",
        "environment"
      ]
    },
    "element_key": {
      "type": "string",
      "minLength": 1,
      "maxLength": 120,
      "pattern": "^[A-Za-z0-9._:-]+$"
    },
    "timestamp_ms": {
      "type": "integer",
      "minimum": 0
    },
    "value_length": {
      "type": "integer",
      "minimum": 0,
      "maximum": 10000
    },
    "edit_count": {
      "type": "integer",
      "minimum": 0,
      "maximum": 10000
    },
    "duration_ms": {
      "type": "integer",
      "minimum": 0,
      "maximum": 3600000
    },
    "reason": {
      "type": "string",
      "enum": [
        "empty_field",
        "control_nonresponsive",
        "validation_error",
        "help_requested",
        "unknown"
      ]
    },
    "navigation_direction": {
      "type": "string",
      "enum": [
        "forward",
        "back",
        "skip",
        "unknown"
      ]
    },
    "pointer_type": {
      "type": "string",
      "enum": [
        "mouse",
        "pen",
        "touch",
        "keyboard",
        "unknown"
      ]
    },
    "file_count": {
      "type": "integer",
      "minimum": 0,
      "maximum": 100
    },
    "file_size_bucket": {
      "type": "string",
      "enum": [
        "none",
        "small",
        "medium",
        "large",
        "unknown"
      ]
    },
    "key_press_count": {
      "type": "integer",
      "minimum": 0,
      "maximum": 10000
    },
    "backspace_count": {
      "type": "integer",
      "minimum": 0,
      "maximum": 10000
    },
    "paste_count": {
      "type": "integer",
      "minimum": 0,
      "maximum": 100
    },
    "chars_per_minute": {
      "type": "integer",
      "minimum": 0,
      "maximum": 2000
    },
    "revisit_count": {
      "type": "integer",
      "minimum": 0,
      "maximum": 1000
    }
  }
}
