{
  "schema_version": "1.1.0",
  "session_id": "session-valid-006",
  "visitor_id": "visitor-valid-006",
  "tenant_id": "researchops",
  "consent": "yes",
  "origin": "formkit",
  "event_class": "env",
  "action": "env.net.offline",
  "role": "environment",
  "element_key": "network.status",
  "timestamp_ms": 1760000007200
}
