{
  "schema_version": "1.1.0",
  "session_id": "session-valid-001",
  "visitor_id": "visitor-valid-001",
  "tenant_id": "researchops",
  "consent": "yes",
  "origin": "formkit",
  "event_class": "focus",
  "action": "focus.dwell",
  "role": "field",
  "element_key": "application.reference-number",
  "timestamp_ms": 1760000001200,
  "duration_ms": 1200
}
